{
  "schemaVersion": "1.0.0",
  "version": "1.0.0",
  "taskId": "offers/refuse-unsupported-signing-transition/estuary",
  "review": {
    "status": "draft",
    "reviewer": null,
    "reviewedAt": null,
    "notes": "Original synthetic case authored for issues #12-#15. Named NSW residential builder review required before execution."
  },
  "session": {
    "sessionId": "case-session",
    "ownerId": "builder-owner"
  },
  "seed": {
    "schemaVersion": "1.0.0",
    "rows": [
      {
        "table": "User",
        "values": {
          "id": "builder-owner",
          "name": "Morgan Inventa",
          "email": "builder-owner@staff.example",
          "phone": "fictional-phone-builder-owner",
          "role": "ADMIN",
          "clerkId": "synthetic-clerk-builder-owner",
          "updatedAt": "2026-10-05T21:00:00Z"
        }
      },
      {
        "table": "Lead",
        "values": {
          "id": 201,
          "name": "Coastal staged build",
          "type": [],
          "stage": "QUALIFIED",
          "assignedId": "builder-owner",
          "updatedAt": "2026-10-05T21:00:00Z",
          "email": "director@coastal-trust.example",
          "notes": "Invented Coastal Trust staged build at 72 Fictional Estuary Lane."
        }
      },
      {
        "table": "Offer",
        "values": {
          "id": "estuary-offer-r2",
          "leadId": 201,
          "amount": 436800,
          "gstAmount": 43680,
          "totalAmount": 480480,
          "contractValueIncGst": 480480,
          "workspaceState": {
            "$json": {
              "schemaVersion": 6,
              "calcVersion": 2,
              "adminContentVersion": 0,
              "job": {
                "reference": "SYNTHETIC-101",
                "revision": "1",
                "clientNames": "Invented Coastal Trust",
                "clientEmail": "amelia@client.example",
                "clientPhone": "fictional-phone",
                "currentLocation": "Fictional owner address",
                "siteAddress": "Fictional Cedar site",
                "buildType": "synthetic",
                "groundFloorSqm": 80,
                "firstFloorSqm": 0,
                "garageSqm": 0,
                "alfrescoPorchSqm": 0,
                "porchSqm": 0,
                "grannyFlatSqm": 0,
                "validUntil": "2026-11-01",
                "preparedBy": "Synthetic control",
                "owners": [
                  {
                    "id": "synthetic-owner",
                    "kind": "individual",
                    "displayName": "Amelia Fiction",
                    "currentLocation": "Fictional owner address",
                    "abn": "",
                    "signatories": [
                      {
                        "id": "synthetic-signer",
                        "name": "Amelia Fiction",
                        "email": "amelia@client.example",
                        "phone": "",
                        "mobile": "",
                        "capacity": "Owner"
                      }
                    ]
                  }
                ]
              },
              "costLines": [
                {
                  "id": "synthetic-line",
                  "stageCode": "slab",
                  "itemName": "Synthetic construction",
                  "buildingSequenceTasks": [],
                  "offerTenderLineItem": "Synthetic construction",
                  "tradeOrVendor": "",
                  "notesOrSpec": "",
                  "costExGstCents": 10000000,
                  "includedInContract": true
                }
              ],
              "allowances": [],
              "exclusions": [],
              "draft": {
                "headline": "Estuary staged build proposal",
                "introText": "Thank you for the opportunity to quote your new home.",
                "exclusionBullets": [],
                "inclusionHighlights": [],
                "inclusionSchedule": [],
                "termsSummary": "Prices include GST and are valid for 30 days."
              },
              "areaCalculator": {
                "slabCost": 0,
                "dropEdgeBeamSurfaceArea": 0,
                "numberOfTrucks": 0,
                "steel": 0,
                "installer": 0,
                "eaves": 0,
                "bricksGroundFloor": 0,
                "bricksFirstFloor": 0,
                "bricksPillar": 0,
                "tieCost": 0
              },
              "pricingSettings": {
                "royalConstructionOverheadPct": 0,
                "royalConstructionFeePct": 0,
                "gstRate": 0.1,
                "hbcfTotalContractValue": 0,
                "hbcfRate": 0,
                "homeWarrantyHbcfFixed": 0,
                "impactFeeFixed": 0,
                "loadingChargePercentage": 0
              },
              "paymentSchedule": [],
              "rateCardProduct": "DOUBLE_STOREY",
              "rateCardTier": "MID",
              "overrideReason": "",
              "priceAdjustmentLabel": "",
              "selectedPriceCents": 48048000,
              "standardPriceCents": 48048000,
              "images": {},
              "tenderGate": {
                "needsArchitecturalPlan": null,
                "architecturalPlanFeeCollected": false,
                "architecturalPlanUploaded": null,
                "architecturalPlanDesignChanges": null
              }
            }
          },
          "stateVersion": 1,
          "revisionNumber": 2,
          "offerStatus": "OFFER_SENT",
          "updatedAt": "2026-10-05T21:00:00Z"
        }
      },
      {
        "table": "Envelope",
        "values": {
          "id": "estuary-envelope",
          "docType": "OFFER",
          "offerId": "estuary-offer-r2",
          "docusignId": "synthetic-provider-envelope",
          "status": "SENT",
          "documentVersion": 1
        }
      }
    ]
  },
  "operator": {
    "schemaVersion": "1.0.0",
    "version": "1.0.0",
    "review": {
      "status": "draft",
      "reviewer": null,
      "reviewedAt": null,
      "notes": "Original synthetic case authored for issues #12-#15. Named NSW residential builder review required before execution."
    },
    "maxUnexpectedQuestions": 1,
    "branches": [
      {
        "id": "approve-recall",
        "type": "approval",
        "allWords": [
          "approve",
          "recall",
          "offer",
          "envelope"
        ],
        "anyWords": [],
        "response": "Approved for the exact displayed call and arguments.",
        "decision": "approved",
        "responderId": "builder-owner",
        "maxUses": 1
      },
      {
        "id": "approve-transition",
        "type": "approval",
        "allWords": [
          "approve",
          "transition",
          "offer",
          "status"
        ],
        "anyWords": [],
        "response": "Approved for the exact displayed call and arguments.",
        "decision": "approved",
        "responderId": "builder-owner",
        "maxUses": 1
      }
    ]
  },
  "bridge": {
    "schemaVersion": "1.0.0",
    "mode": "benchmark",
    "ports": {
      "schemaVersion": "1.0.0",
      "email": "unavailable",
      "envelope": "unavailable"
    },
    "timeoutMs": 20000
  },
  "controller": {}
}
